{
  "contract": "A.Literature",
  "schema_version": "2.0",
  "artifact_id": "A-literature-demo-v2",
  "producer": "person-b/literature-preparation:fixture-v1",
  "payload": {
    "corpus": {
      "corpus_id": "who-breast-tumours-5e-fixture",
      "title": "Breast Tumours (5th ed.)",
      "source_file": "cleanSections_metaList_fixture.json",
      "source_path": "/fixtures/cleanSections_metaList_fixture.json",
      "sha256": "0000000000000000000000000000000000000000000000000000000000000000",
      "source_size_bytes": 1,
      "literature_count": 4
    },
    "literature_list": [
      {
        "literature_id": "lit-fixture-navigation",
        "source_idx": 0,
        "level": 1,
        "title_list": [
          "Breast Tumours (5th ed.)",
          "2. Epithelial tumours of the breast",
          null,
          null
        ],
        "title": "2. Epithelial tumours of the breast",
        "href": null,
        "sections": []
      },
      {
        "literature_id": "lit-fixture-ibc-nst",
        "source_idx": 1,
        "level": 3,
        "title_list": [
          "Breast Tumours (5th ed.)",
          "2. Epithelial tumours of the breast",
          "Invasive breast carcinoma: General overview",
          "Invasive breast carcinoma of no special type"
        ],
        "title": "Invasive breast carcinoma of no special type",
        "href": "https://tumourclassification.iarc.who.int/chaptercontent/32/19",
        "sections": [
          {
            "section_id": "sec-fixture-ibc-histopathology",
            "section_idx": 0,
            "title": "Histopathology",
            "text": "Invasive breast carcinoma of no special type shows invasive malignant epithelial cells with variable gland formation and stromal response."
          },
          {
            "section_id": "sec-fixture-ibc-icdo",
            "section_idx": 1,
            "title": "ICD-O coding",
            "text": "None"
          }
        ]
      },
      {
        "literature_id": "lit-fixture-ilc",
        "source_idx": 2,
        "level": 3,
        "title_list": [
          "Breast Tumours (5th ed.)",
          "2. Epithelial tumours of the breast",
          "Invasive breast carcinoma: General overview",
          "Invasive lobular carcinoma"
        ],
        "title": "Invasive lobular carcinoma",
        "href": "https://tumourclassification.iarc.who.int/chaptercontent/32/21",
        "sections": [
          {
            "section_id": "sec-fixture-ilc-histopathology",
            "section_idx": 0,
            "title": "Histopathology",
            "text": "Invasive lobular carcinoma commonly contains discohesive cells infiltrating in single files and targetoid patterns."
          }
        ]
      },
      {
        "literature_id": "lit-fixture-udh",
        "source_idx": 3,
        "level": 3,
        "title_list": [
          "Breast Tumours (5th ed.)",
          "2. Epithelial tumours of the breast",
          "Benign epithelial proliferations and precursors: Introduction",
          "Usual ductal hyperplasia"
        ],
        "title": "Usual ductal hyperplasia",
        "href": "https://tumourclassification.iarc.who.int/chaptercontent/32/4",
        "sections": [
          {
            "section_id": "sec-fixture-udh-histopathology",
            "section_idx": 0,
            "title": "Histopathology",
            "text": "Usual ductal hyperplasia is a heterogeneous benign epithelial proliferation with irregular slit-like lumina."
          }
        ]
      }
    ]
  }
}
